mysql> show databases;
+--------------------+
| Database           |
+--------------------+
| employee           |
| employees          |
| information_schema |
| mysql              |
| performance_schema |
| sakila             |
| school             |
| sql_programs       |
| sys                |
| world              |
+--------------------+
10 rows in set (0.01 sec)

mysql> select * from emp;
+----+----------+------------+------------+-----+-------+
| id | name     | dept       | income     | age | hired |
+----+----------+------------+------------+-----+-------+
|  1 | Vinitha  | IT         | 2500000.00 |  30 | NULL  |
|  2 | Kiran    | HR         |   45000.00 |  50 | NULL  |
|  3 | Ravi     | Finance    |   55000.00 |  45 | NULL  |
|  4 | Charitha | IT         |   50000.00 |  30 | NULL  |
|  5 | Bhargavi | Accounts   |  100000.00 |  35 | NULL  |
|  7 | Navya    | Compuetrs  |   15000.00 |  25 | NULL  |
|  8 | Sandhya  | IT         |   12000.00 |  40 | NULL  |
|  9 | Lohitha  | Electrical |   20000.00 |  30 | NULL  |
| 11 | Narayan  | Biology    |   29000.00 |  31 | NULL  |
+----+----------+------------+------------+-----+-------+
9 rows in set (0.00 sec)

mysql> select * from class;
+--------+----------+------------+-------+-----------+-----------+
| rollno | name     | joindate   | marks | location  | cname     |
+--------+----------+------------+-------+-----------+-----------+
|      1 | Rahul    | 2025-12-02 |    80 | NEWYORK   | 2nd class |
|      2 | Hema     | 2023-05-25 |    50 | Tirupathi | 3rd class |
|      3 | Hari     | 2022-02-02 |    60 | Chittoor  | 4rd class |
|      4 | Kalyani  | 2001-08-30 |    90 | Bangalore | 7rd class |
|      5 | Thanooja | 2000-01-12 |    95 | Tirupathi | LKG       |
|      6 | Mounika  | 2003-05-30 |    95 | Chicago   | 9th class |
+--------+----------+------------+-------+-----------+-----------+
6 rows in set (0.00 sec)

mysql> select * from book;
+----+-------+
| id | price |
+----+-------+
|  1 |     2 |
|  2 |     2 |
|  3 |     3 |
|  4 |     4 |
|  5 |     5 |
|  6 |    11 |
|  7 |    22 |
|  8 |    33 |
|  9 |    44 |
| 10 |    55 |
+----+-------+
10 rows in set (0.00 sec)

mysql> select mod(price/2) from book;
ERROR 1064 (42000): You have an error in your SQL syntax; check the manual that corresponds to your MySQL server version for the right syntax to use near ') from book' at line 1
mysql> select mod(9/3);
ERROR 1064 (42000): You have an error in your SQL syntax; check the manual that corresponds to your MySQL server version for the right syntax to use near ')' at line 1
mysql> select mod(33,3);
+-----------+
| mod(33,3) |
+-----------+
|         0 |
+-----------+
1 row in set (0.00 sec)

mysql> select mod(44,9);
+-----------+
| mod(44,9) |
+-----------+
|         8 |
+-----------+
1 row in set (0.00 sec)

mysql> select mod (349589,8);
+----------------+
| mod (349589,8) |
+----------------+
|              5 |
+----------------+
1 row in set (0.00 sec)

mysql> select * from emp where mod(sal,2)=0;
ERROR 1054 (42S22): Unknown column 'sal' in 'where clause'
mysql> alter table emp set column income to sal;
ERROR 1064 (42000): You have an error in your SQL syntax; check the manual that corresponds to your MySQL server version for the right syntax to use near 'set column income to sal' at line 1
mysql> update emp set column income to sal;
ERROR 1064 (42000): You have an error in your SQL syntax; check the manual that corresponds to your MySQL server version for the right syntax to use near 'column income to sal' at line 1
mysql> alter table emp rename column income to sal;
Query OK, 0 rows affected (0.27 sec)
Records: 0  Duplicates: 0  Warnings: 0

mysql> select * from emp;
+----+----------+------------+------------+-----+-------+
| id | name     | dept       | sal        | age | hired |
+----+----------+------------+------------+-----+-------+
|  1 | Vinitha  | IT         | 2500000.00 |  30 | NULL  |
|  2 | Kiran    | HR         |   45000.00 |  50 | NULL  |
|  3 | Ravi     | Finance    |   55000.00 |  45 | NULL  |
|  4 | Charitha | IT         |   50000.00 |  30 | NULL  |
|  5 | Bhargavi | Accounts   |  100000.00 |  35 | NULL  |
|  7 | Navya    | Compuetrs  |   15000.00 |  25 | NULL  |
|  8 | Sandhya  | IT         |   12000.00 |  40 | NULL  |
|  9 | Lohitha  | Electrical |   20000.00 |  30 | NULL  |
| 11 | Narayan  | Biology    |   29000.00 |  31 | NULL  |
+----+----------+------------+------------+-----+-------+
9 rows in set (0.00 sec)

mysql> select * from emp where mod(sal,2)=0;
+----+----------+------------+------------+-----+-------+
| id | name     | dept       | sal        | age | hired |
+----+----------+------------+------------+-----+-------+
|  1 | Vinitha  | IT         | 2500000.00 |  30 | NULL  |
|  2 | Kiran    | HR         |   45000.00 |  50 | NULL  |
|  3 | Ravi     | Finance    |   55000.00 |  45 | NULL  |
|  4 | Charitha | IT         |   50000.00 |  30 | NULL  |
|  5 | Bhargavi | Accounts   |  100000.00 |  35 | NULL  |
|  7 | Navya    | Compuetrs  |   15000.00 |  25 | NULL  |
|  8 | Sandhya  | IT         |   12000.00 |  40 | NULL  |
|  9 | Lohitha  | Electrical |   20000.00 |  30 | NULL  |
| 11 | Narayan  | Biology    |   29000.00 |  31 | NULL  |
+----+----------+------------+------------+-----+-------+
9 rows in set (0.00 sec)

mysql> select * from emp where mod(sal,3)=0;
+----+---------+-----------+----------+-----+-------+
| id | name    | dept      | sal      | age | hired |
+----+---------+-----------+----------+-----+-------+
|  2 | Kiran   | HR        | 45000.00 |  50 | NULL  |
|  7 | Navya   | Compuetrs | 15000.00 |  25 | NULL  |
|  8 | Sandhya | IT        | 12000.00 |  40 | NULL  |
+----+---------+-----------+----------+-----+-------+
3 rows in set (0.00 sec)

mysql> select * from class where mod(id,2)=0;
ERROR 1054 (42S22): Unknown column 'id' in 'where clause'
mysql> select * from class;
+--------+----------+------------+-------+-----------+-----------+
| rollno | name     | joindate   | marks | location  | cname     |
+--------+----------+------------+-------+-----------+-----------+
|      1 | Rahul    | 2025-12-02 |    80 | NEWYORK   | 2nd class |
|      2 | Hema     | 2023-05-25 |    50 | Tirupathi | 3rd class |
|      3 | Hari     | 2022-02-02 |    60 | Chittoor  | 4rd class |
|      4 | Kalyani  | 2001-08-30 |    90 | Bangalore | 7rd class |
|      5 | Thanooja | 2000-01-12 |    95 | Tirupathi | LKG       |
|      6 | Mounika  | 2003-05-30 |    95 | Chicago   | 9th class |
+--------+----------+------------+-------+-----------+-----------+
6 rows in set (0.00 sec)

mysql> select * from class where mod(rollno,2)=0;
+--------+---------+------------+-------+-----------+-----------+
| rollno | name    | joindate   | marks | location  | cname     |
+--------+---------+------------+-------+-----------+-----------+
|      2 | Hema    | 2023-05-25 |    50 | Tirupathi | 3rd class |
|      4 | Kalyani | 2001-08-30 |    90 | Bangalore | 7rd class |
|      6 | Mounika | 2003-05-30 |    95 | Chicago   | 9th class |
+--------+---------+------------+-------+-----------+-----------+
3 rows in set (0.00 sec)

mysql> select * from book where mod(price,4)=0;
+----+-------+
| id | price |
+----+-------+
|  4 |     4 |
|  9 |    44 |
+----+-------+
2 rows in set (0.00 sec)

mysql> select * from class where mod(marks,7)=0;
Empty set (0.00 sec)

mysql> select * from emp where mod(sal,5)=0;
+----+----------+------------+------------+-----+-------+
| id | name     | dept       | sal        | age | hired |
+----+----------+------------+------------+-----+-------+
|  1 | Vinitha  | IT         | 2500000.00 |  30 | NULL  |
|  2 | Kiran    | HR         |   45000.00 |  50 | NULL  |
|  3 | Ravi     | Finance    |   55000.00 |  45 | NULL  |
|  4 | Charitha | IT         |   50000.00 |  30 | NULL  |
|  5 | Bhargavi | Accounts   |  100000.00 |  35 | NULL  |
|  7 | Navya    | Compuetrs  |   15000.00 |  25 | NULL  |
|  8 | Sandhya  | IT         |   12000.00 |  40 | NULL  |
|  9 | Lohitha  | Electrical |   20000.00 |  30 | NULL  |
| 11 | Narayan  | Biology    |   29000.00 |  31 | NULL  |
+----+----------+------------+------------+-----+-------+
9 rows in set (0.00 sec)

mysql> select * from emp where mod(age,50)=0;
+----+-------+------+----------+-----+-------+
| id | name  | dept | sal      | age | hired |
+----+-------+------+----------+-----+-------+
|  2 | Kiran | HR   | 45000.00 |  50 | NULL  |
+----+-------+------+----------+-----+-------+
1 row in set (0.00 sec)

mysql>